"Проверил, как идет ремонт дорог в Красноярске. Особое внимание уделил участкам, по которым получал от вас обращения и жалобы. Работа идет, подрядчики стараются уложиться в срок. 

Пока погода позволяет, нужно сделать максимум, решить все наболевшие вопросы. На красноярские дороги выделяем дополнительно 511 млн рублей. Соответствующие решения должны оперативно оформить краевые и муниципальные органы власти.  

Обязал исполнителей придерживаться комплексного подхода - делать сразу дорожное покрытие, бордюры, тротуары, парковочные карманы. Качество работ будем жестко контролировать. Если где-то увидим недочеты, то переделывать подрядчик будет за свой счет."
"Обсудили с министром экономического развития Максимом Решетниковым предстоящее закрытие старых и создание новых экологически чистых производств КРАЗа. Заводы в Красноярске будут работать только по современным экологичным технологиям, и никак иначе.

Это моя принципиальная позиция, которую разделяют и представители федеральной власти, и руководители краевых предприятий."
"Заслушал доклад главы Канска по ситуации со взрывом газа. Все семьи из пострадавшего подъезда будут размещены в пункте временного содержания.

Некоторые жители приняли решение разместиться у родственников. Для всех остальных будет организовано горячее питание. 

С причинами взрыва разбираются правоохранительные и надзорные органы. Поставил задачу краевым и муниципальным властям в ближайшее время отремонтировать пострадавшие квартиры. 

Лично приеду в Канск в ближайшие дни. На месте проверю, как организована помощь пострадавшим семьям. Слава Богу, что обошлось без жертв."
"С министром экономического развития России Максимом Решетниковым мы проработали несколько ключевых для края тем:

- перевод предприятий на экологичные методы производства 

- развитие промышленности

- дальнейшие перспективы технологической долины и привлечение инвесторов 

Промышленность – основа экономики Красноярского края. Именно заводы дают рабочие места, зарплаты, средства на строительство больниц, школ и детсадов, оплату труда врачей и учителей.

Поэтому мы укрепляем промышленность в первую очередь. Министерство экономического развития России оказывает нам поддержку в этом вопросе."
"Встретился с жителями, пострадавшими при взрыве бытового газа в Канске. Главная задача сейчас  максимально быстро устранить все последствия и провести ремонт дома, пока не начались холода. У жильцов должен быть полный календарный план всех работ, контролировать ход исполнения буду лично. 

Однако устранением последствий и помощью пострадавшим мы не ограничимся  важно извлечь уроки из произошедшего и наказать виновных. В организации, которая проводила работы, проводятся служебные проверки. Первые кадровые решения уже приняты. Уволен начальник производственно-технического отдела, часть сотрудников уже отстранены. В отношении руководителей проверки еще ведутся, если будет установлена их вина  никто от ответственности не уйдет."
"Чтобы учителя и врачи приезжали работать в районы и города края, им нужно создавать достойные условия жизни. Главы должны быть в этом заинтересованы. Сегодня в Канске заехал на стройплощадку новой пятиэтажки. Дом почти готов. Совсем скоро 64 квартиры передадим нашим врачам, учителям и детям-сиротам. 

На осмотр пригласил будущих жильцов, вместе посмотрели планировку, оценили качество работ. Обратили внимание на подъездную дорогу. К сдаче дома глава города обещал привести ее в порядок. Держу этот момент на контроле.

Такие объекты нужны многим нашим районам, и важно, чтобы они сдавались в срок и в хорошем качестве."
"В Канске запланирован плотный рабочий график, но мне пришлось его скорректировать. Жительница Канска Светлана позвала в свой двор, где местные власти пять лет игнорируют просьбы сделать хорошую площадку для детей. 

Управляющая компания бездействует, городская администрация на это не влияет, а в итоге дети этого двора играют рядом с железной дорогой и без нормальных, современных условий. 

Если УК не слышит людей, то им на помощь должны приходить местные чиновники. Требую от администрации Канска обеспечить безопасность детей и решить вопрос с оснащением детской площадки как можно быстрее."
"Как и обещал, приехал в Канск и Канский район. Эту поездку планировал давно, но ЧП с газом внесло коррективы в её график.

Встретился с жильцами пострадавшего от взрыва дома. Выслушал людей, рассказал им о принимаемых мерах по восстановлению жилья. Всех виновных в ЧП привлечём к ответственности. 

Разбирался с жалобой на нехватку мест в детском саду в Филимоново. Строим новое здание, чтобы расширить дошкольное учреждение и решить этот вопрос.

В канском детсаду Малышок другая проблема. Там течёт кровля. Поручил отремонтировать её до первого сентября.

На встречу с жителями пришло более 600 человек. Вопросов много. На некоторые из них ответил сам. На другие потребовал ответа от присутствовавшего в зале главы города Канска.

Одно из обращений было по созданию южного обхода города. После встречи съездил на этот объект с инспекцией. Мост через реку Кан и 18 километров дороги строят строго по графику.

Про ситуацию с отсутствующей детской площадкой и играющими около железной дороги детьми уже рассказывал. Распорядился сделать всё в сжатые сроки.

Буду приезжать в Канск регулярно. Информацию о встречах с жителями поручил публиковать заранее, чтобы все желающие могли прийти."
"Вместе с министром сельского хозяйства России Дмитрием Патрушевым посетили сельхозпредприятия, которые задают планку для всего края и помогают нам оставаться в лидерах среди сибирских регионов.

В Красноярском крае сформирован мощный научный потенциал для развития сельского хозяйства. Аграрный университет, наши технические вузы, Академгородок тесно работают с аграриями. Совместными усилиями открываются селекционные центры, которые создают урожайные районированные семена.

Обсудили с министром и планы по развитию агропромышленного комплекса региона. В ближайшие несколько лет планируем реализовать в крае 38 инвестпроектов  от обновления фабрик и хранилищ до создания нового комплекса по переработке зерна."
"Подготовку к празднованию 100-летия со дня рождения Виктора Астафьева обсудили с министром культуры России Ольгой Любимовой.

В следующем году по всей стране пройдут фестивали, концерты, лекции и выставки, посвященные юбилею Виктора Петровича. Разумеется, главным центром праздника станет Овсянка  родное село писателя. Уже в следующем году там откроется Национальный центр Астафьева.

Еще одной темой стало обновление наших учреждений культуры. В рамках нацпроекта Культура идут работы в ТЮЗе. А ремонт здания Красноярского государственного театра оперы и балета им. Д. А. Хворостовского планируем сделать до празднования 400-летия Красноярска."
"Много лет играю в баскетбол и очень его люблю. Занимаюсь не профессионально – для себя. Командные игры объединяют и заряжают позитивом. Поддерживать себя в спортивной форме под силу каждому из нас.  
 
Очень рад, что все больше жителей края выбирают здоровый образ жизни, практически каждый второй занимается спортом! Для этого строим площадки ГТО, спортивные комплексы в разных городах и районах. Ежегодно – более 60 новых объектов. 
 
Для всех, кто дружит со спортом, сегодня особенный день. С праздником вас, с Днем физкультурника!"
"Сегодня с зампредседателя Правительства России Маратом Хуснуллиным работаем в Красноярске. Марат Шакирзянович на федеральном уровне курирует стройку красноярского метро. Вместе проехали по всем площадкам и посмотрели, как идут работы. Самая активная стадия сейчас на улице Молокова. Здесь строители уже приступили к возведению котлована. На остальных площадках идет подготовка  - завозят технику, выносят сети, проводят исследования. 

Подрядчики подтвердили изначальные сроки строительства – 2026 год.

Поднял и другие темы, в частности развитие аэропорта и автодорожной инфраструктуры, строительство качественного жилья. По всем вопросам были получены заверения в поддержке Правительства России.

Как верно отметил Марат Шакирзянович, самый тяжелый путь  начало, и мы его уже преодолели."
"  Красный Яр вышел в полуфинал Кубка России по регби. На своем поле обыграли новокузнецкий Металлург 38:14
Мои поздравления ребятам!

Получил непередаваемое удовольствие от игры. Удачи в следующей с Пензой!"
""
""
""
"Сегодня выступал перед участниками проекта ГосСтарт  молодыми людьми, госслужащими, из регионов Сибири и Дальнего востока. Некоторые из них только начинают свой путь на государственной службе. 

Проект поддерживает Министерство науки и высшего образования России и АНО Россия – страна возможностей. И без преувеличения он является кузницей молодых управленческих кадров.

Для меня важно на своем примере показать новому поколению, что в основе государственной службы лежит служение людям и их интересам. Сегодня есть запрос не только на открытость нашей работы, но и на то, чтобы учитывалось каждое мнение."
"Поручал главам всех муниципалитетов лично работать с обращениями людей. 

Вчера по этой задаче заслушал подробный доклад главы Красноярска Владислава Анатольевича Логинова. 

Отдельно обсудили вопросы по строительству школ в городе и защите прав граждан, дома которых предполагается расселить в Николаевке. 

Комплексное развитие территорий города Красноярска должно идти таким образом, чтобы интересы всех жителей были защищены. Застройщик реализует свой коммерческий проект, но социальную ответственность с него никто не снимал. Мэрии дано поручение оказать поддержку жителям Николаевки. Все должны получить справедливую цену на свое жилье, никто не должен остаться на улице. 

Аналогичные отчеты буду регулярно получать и от мэра Красноярска, и от всех других глав. 

Власть обязана слышать людей и работать для них."
""
"На Минусинском инвестиционном форуме собралось более 400 специалистов из разных регионов и стран. Вместе мы разрабатываем стратегические решения, которые лягут в основу будущего южной столицы края, улучшат жизнь в Минусинске и привлекут сюда новых людей. 

Потому что сейчас в городе, спроектированном на 350 тысяч жителей, фактически их намного меньше. Чтобы исправить эту ситуацию, нужны перемены в здравоохранении, образовании, дорожном строительстве, социальной инраструктуре, и других ключевых сферах. В том числе и в экологии, потому что без решения этого вопроса сюда просто никто не поедет.

Некоторые проблемы уже частично решены в рамках подготовки к 200-летнему юбилею. Но это не столько развитие, сколько наверстывание упущенного в предыдущие годы. Годы, когда наш регион участвовал только в трети федеральных программ и потому недополучал колоссальные ресурсы.

Пора двигаться вперед. Начать следует с создания комплексного плана развития города, как в Норильске. Разработать план, включающий в себя ресурсы федерального, регионального и местного уровня. И реализовывать этот план, во-первых, настойчиво. Во-вторых, трезво понимая, что дорогу осилит идущий. Когда нас встретят какие-то трудности – а они неизбежно случатся – нужно сплачиваться и уверено делать следующий шаг. 

В этом и есть наша стратегическая задача. Уверен, вместе мы с ней справимся."
"Во время прогулки по Минусинску встретил нашего чемпиона мира по боксу Марка Петровского. 
Марк получил высшее образование в Москве, но вернулся в родной город. Он считает, что Минусинск преображается, и лучше малой Родины места нет.

Полностью согласен с Марком. Минусинск действительно стал лучше. Однако останавливаться на достигнутом нельзя. Многое ещё предстоит сделать."
"Развитие юга края стало центральной темой последних дней. Об этом мы говорили и на Минусинском инвестиционном форуме, и на встрече с главами городов и районов.  
 
Все, что нужно для экономического и социального роста на юге края, уже есть  это и крупные предприятия, и необходимые ресурсы, и инвестиционный потенциал.  
 
В пример приведу соседний Курагинский район и его предприятие Березовское. За 20 лет работы оно разрослось на 5 населенных пунктов и теперь не только обеспечивает местных жителей рабочими местами, но и оказывает финансовую поддержку в благоустройстве сел и деревень. Таких предприятий в нашем крае должно быть больше. 
 
Отдельно хочется поблагодарить всех, кто принимал участие в создании праздника в честь 200-летия Минусинска. Город заметно преобразился, это отметили многие гости, которые приехали на юбилей."
"Приехал в Солнечный, чтобы с жителями обсудить развитие этого микрорайона. Многоквартирных домов здесь достаточно, а школ и поликлиник не хватает. Поручил приостановить выдачу разрешений на строительство новых домов в Солнечном, пока не разберемся с социальной инфраструктурой.

Остро нуждается в новой школе 5-й микрорайон. Подготовка к строительству идет, вносятся изменения в проект планировки. В следующем году будет готова школа в 3-м микрорайоне.  

Много жалоб от жителей, что действующая поликлиника не справляется с потоком людей. Сегодня выбрали площадки, где можно построить новую поликлинику. Вместе с жителями примем окончательное решение, какое место наиболее удобно. 

Проверил, как благоустраивают парк Солнечная поляна, основные площадки готовы. Рядом ведется строительство бассейна. Хороший пример работы. Место востребовано местными жителями. 

На футбольном поле Ротор пообщался с юными спортсменами. Им очень недостает теплых раздевалок. Поручил мэру Красноярска Владиславу Логинову решить этот вопрос, чтобы детям было комфортно заниматься. 

Эти и другие вопросы обсудили на встрече с жителями. Солнечным нужно плотно заниматься, поэтому поручил городу ввести должность заместителя мэра, курирующего развитие красноярской агломерации. Новая структура будет заниматься всеми территориями агломерации, но базироваться должна в Солнечном. Так проблемы людей будут понятнее, а значит, и решаться будут быстрее."
"Сегодня День государственного флага. 

По традиции на площадке перед СФУ с курсантами и студентами участвовал в праздничной церемонии. Вместе с Романом Саютиным, участником спецоперации, награжденным медалями Суворова и За отвагу, торжественно подняли российский триколор.

Уважение к флагу  это уважение к своей истории, культуре и традициям, это знак сильной и независимой страны.

С праздником, друзья!"
