"На встрече в Минусинске был полный зал. Видно, что у людей наболело. И я их прекрасно понимаю. Часто бывал в городе в разные годы и знаю, как здесь обстоят дела с дорогами, экологией и здравоохранением. 

Не менее важен вопрос открытости местных властей людям. Руководство района и города обязано работать в прямом диалоге с людьми. Я требую от глав полной открытости к жителям и добьюсь её."
"Приезжал в Школу молодого педагога, чтобы обсудить с учителями значимые для них вопросы. В первую очередь всё то, что касается мер поддержки наших педагогов. 

Районы и школы обязаны создать условия для качественной работы молодых специалистов. Соответствующую задачу главам я поставил. За выполнением прослежу. С учителями буду встречаться ещё не раз."
"Национальные проекты должны улучшить ситуацию в крае к следующему году. Их надо выполнить в срок. Поставил такую задачу Минстрою и Минздраву.

Требую персональной ответственности за реализацию нацпроектов. Каждый объект – это строчка с конкретным именем, фамилией и отчеством. По результатам этой работы буду принимать кадровые решения."
"Личные приёмы важны для меня не только как возможность адресно помочь людям, но и как способ свериться с реальностью. В отчётах, планах и проектах вижу одно, в жизни – другое. 

Детская площадка. Связь в отдалённом селе. Найти компьютер семье, чтобы дети могли хоть иногда поговорить с находящимся на СВО отцом. 

Это не мелочи. Для вот этого конкретного мальчика сейчас важнее всего на свете поговорить с папой. А без связи в селе людям как жить?

Буду проводить такие приёмы регулярно."
"В день семьи, любви и верности поздравил семью Олехнович с победой в первом этапе конкурса Семья года. У Алексея и Ирины шестеро детей. Растить и воспитывать их не всегда просто.

Но Олехновичи хорошо справляются. Старшие помогают родителям с младшими, и все живут дружно. Будем на них равняться."
"Проверил, как идёт строительство двух важных дорожных объектов. По трассе Красноярск - Элита вопросов нет. Дорожники с поставленной задачей справляются. 

Развязку в районе Дрокино (дорога в аэропорт) делают с существенным нарушением сроков. Будем менять подрядчика."
"Президент Владимир Путин подписал указ о присвоении звания Героя России жителю Канска Олегу Ликонцеву. Эту высшую государственную награду наш земляк заслужил своими подвигами в тяжёлом бою.

Батальон сибирских добровольцев во главе с комбатом Ликонцевым 16 часов подряд отбивал атаки многократно превосходящих сил противника. Наши бойцы удержали позиции под ударами артиллерии, танков, дронов-камикадзе и штурмовиков противника.

Когда враг выдохся, добровольцы сами поднялись в атаку и отбросили его на половину километра назад. 

Я от всей души поздравляю Олега Валерьевича Ликонцева с заслуженной наградой."
"Поговорил с журналистами сразу двух газет. Ответил на вопросы о медицине, нехватке школ и детсадов, дорогах, поездках в районы, встречах с людьми, мостах, выпускниках, 400-летии столицы края и моей прописке в крае.

Полные версии интервью скоро выйдут в газетах."
"Продолжаем обновлять общественный транспорт в городах и районах края. Большую партию из 146 автобусов приобрели за счет краевого бюджета. ЛиАЗы, а также ПАЗы и ГАЗели отправятся туда, где автопарк сильно изношен. 

Однако темпы обновления транспорта необходимо ускорять. Дополнительно к нашим краевым деньгам одни из первых в России получили 1 миллиард рублей из федерального бюджета на обновление транспорта. 
На них в этом году закупим еще 93 автобуса, которые будут работать на пригородных и междугородных маршрутах, в городах и сельской местности. 

Важно, чтобы люди в нашем крае могли передвигаться с комфортом."
""
""
"Второй день работаем с нашим земляком, вице-премьером российского правительства Александром Новаком. 

Вчера в Красноярске провели совещание по подготовке к 400-летнему юбилею краевой столицы. За ближайшее пять лет город должен серьезно преобразиться. Важно создать качественную инфраструктуру с запасом, на вырост. Так, как это делали в советское время. Вице-премьер пообещал поддержать наши инициативы на самом высоком уровне. 

Сегодня работаем в Норильске. 
В самом северном городе края идет большая программа реновации, которую совместно проводят компания Норильский никель, федеральные и региональные власти. Уже сейчас заметно, как возникает новый образ города. 
На Надеждинском заводе заслушали доклад руководства комбината о подготовке запуска в этом году первой очереди так называемого серного проекта, который должен существенно улучшить экологическую ситуацию в Норильске."
"Пятницу вместе с вице-премьером Александром Новаком провели в Норильске. 

Город меняется. Запущена большая реновация. Уже работает многопрофильный центр соцобслуживания. Начато строительство нового образовательного комплекса на 1100 мест, возводят поликлинику, идет реконструкция здания под детский сад. Не за горами появление ледовой арены и бассейна. 

Меняется и городская среда – в Норильске обустраивают пешеходную улицу, благоустраивают дворовые и общественные территории. 

Впервые за много лет в Норильске идет возведение жилья. Первую девятиэтажку достроят уже в этом году. Видно, что строители стараются все сделать в срок.

Как и у всех норильчан, у меня есть вопрос: Что будет с экологией в Норильске?. Проинспектировали, как идет работа по серному проекту. В сентябре компания Норильский никель обещает запустить первый комплекс, это должно улучшить экологическую ситуацию в городе. Выбросы диоксида серы снизятся почти в два раза.

Перемены заметны, но сделать нужно еще очень много."
С Днём металлурга!
"Сегодня вынес на обсуждение с членами правительства вопросы строительства дорог в крае. Эта тема волнует жителей, я вижу это в ваших обращениях. 

Мы выделяем немалые средства на строительство и ремонт дорог, большая поддержка идет от федерального Правительства. Задача ответственных за эту работу - строить качественно и в разумные сроки. 

Есть отдельные случаи, когда даже с деньгами кто-то не успевает построить дороги, которых так долго ждут. Это недопустимо! Если чиновники не умеют планировать работу, будем помогать тем, кто с этим справляется лучше."
"На штабе по строительству метро разобрали все сложные вопросы, требующие немедленного решения. 

Наконец-то перешли от слов к делу - подрядчики работают активно, однако темпы работы нужно увеличивать и устранить имеющиеся разногласия. Буду лично это контролировать и требовать от всех участников строительства. 

Красноярцы ждут метро давно."
"Проверил, как идет строительство поликлиники на Пашенном. 

Микрорайон растет, и поликлиника там давно нужна. Подрядчик обещает закончить работы за год. 

Уже сейчас важно определить, как будет организовано благоустройство, парковочное пространство, да и в самой поликлинике все должно быть по уму, чтобы красноярцам было удобно туда обращаться.

Проблема с поликлиниками есть и в быстрорастущем микрорайоне Солнечном, в котором проживают 90 тысяч человек. Найдем средства, будем решать. 

В этом году в Красноярске отремонтируют пять поликлиник. По краю капремонт проведем в 16 учреждениях."
"Обсудили с министром здравоохранения Михаилом Мурашко ситуацию в здравоохранении Красноярского края. Эта тема входит в топ обращений жителей в социальных сетях, решению накопившихся проблем будем уделять особое внимание. 

Пригласил министра в августе приехать к нам в край. Вместе будем разбираться в вопросах, о которых вы пишете."
"Сегодня узнал, что мой друг и коллега Сергей Сокол, с которым мы много лет вместе проработали в администрации Красноярского края,  Аппендицит, перитонит. Насколько я знаю, операция прошла хорошо, и Сергей Михайлович идет на поправку.

Он всегда отличался характером и выдержкой. Знаю, что он один из первых отказался от брони, положенной депутатам Госдумы, и, подписав контракт, отправился на фронт, где прослужил почти полгода. Поэтому я лично уверен в том, что со здоровьем все у него будет хорошо. 

Желаю поскорее вернуться в строй и продолжить работу на благо Хакасии, где в 2021 году он избрался в Госдуму по одномандатному округу. Уверен, что нас ждет еще много перспективных совместных проектов впереди."
"С министром экономического развития РФ Максимом Решетниковым в Москве обсуждали реализацию национальных проектов в регионе. 

Тема важная. От того, как мы работаем в этом направлении, зависит качество жизни людей - какие будут дороги, в каких больницах будем лечиться, какое образование получат наши дети и множество других факторов. 

Считаю, что исполнение поставленных показателей по нацпроектам - залог улучшения жизни красноярцев."
"Дорогие друзья, в этот четверг, 27 июля, в 19.00, проведу очередной прямой эфир. В это время буду работать в Норильске, так что он впервые пройдет из нашей северной столицы.

Буду с вами на прямой связи в соцсетях: 

ТГ: 
ВК: 
ОК: 

Отвечу на вопросы, которые вы напишете под этим постом."
"Сегодня весь день работал в Железногорске. Высокие технологии на предприятиях, увлечённые своей работой люди, но город способен на большее. Его точно можно и нужно развивать, и вместе с жителями мы сможем это сделать.

Железногорску пора наверстать упущенное. Нужны совместные усилия краевого правительства, градообразующих предприятий, муниципальных властей и Росатома. Тогда амбициозные планы по превращению города в научный и технический центр края станут реальностью."
""
""
"Вчера работали в Норильске с премьер-министром России Михаилом Мишустиным. Рассказал, какие вопросы и проблемы волнуют жителей, что требует особого внимания – это экология, жилищно-коммунальное хозяйство, дороги. 

Много усилий сейчас прилагаем, чтобы медицинские специалисты ехали в районы, и у них была мотивация там оставаться. А для этого должны быть социальная поддержка, жилье, должная инфраструктура и благоустройство в территориях края. 

Федеральный центр готов нам помочь с развитием авиационного сообщения, Высокогорским мостом, строительством метро, благоустройством Красноярска в рамках подготовки к 400-летию, а также с другими масштабными проектами."
"Встреча в Норильске шла два часа. Много обращений про проблемы вахтовиков, ремонт школ, дороги, благоустройство, помощь семьям участников СВО, развитие городов.

На часть вопросов ответы дал сразу, остальные взяли в работу. На встречу пригласил также главу Норильска и руководителей крупнейших предприятий. Пусть решают накопившиеся проблемы.

Также обязал глав всех муниципалитетов края напрямую работать с обращениями людей."
"Во время прямого эфира в Норильске обсудил с жителями проблемы и пути их решения по работе недобросовестных УК, благоустройству дворов и другие. 
Подробности в видео"
"Требую от власти открытости к людям. Обязал глав муниципалитетов и краевых министров работать с обращениями жителей края напрямую. И отчитываться о результатах этой работы как мне, так и людям."
"В Красноярске есть несколько новых микрорайонов без должной социальной инфраструктуры. Кто-то замечательно сэкономил на школах, детских садах, больницах и других важных объектах.

Поручил главе города найти землю под строительство инфраструктуры. Будем спасать людей, ставших заложниками этой ситуации. За три года закроем потребность в школах.

И практику безответственной выдачи разрешений на строительство прекратим."
"Сегодня работаем в крае вместе с помощником Президента России Максимом Станиславовичем Орешкиным. Начали с осмотра аэропорта Красноярск, обсудили перспективы развития краевой авиации, расширение маршрутной сети. Наша задача – создать здесь, в столице Сибири, ключевой воздушный узел всего федерального округа. 

Сегодня же успели ознакомиться с важнейшими проектами в северных территориях региона. Показал помощнику Президента Высокогорский мост, предприятия лесопромышленного комплекса и цветной металлургии. 

Продолжим работу завтра. В планах встреча с представителями крупнейших промышленных предприятий края и предпринимателями. Обязательно поговорим о развитии нашего Университета. Максим Станиславович готов обеспечить поддержку нашим инициативам на самом высоком уровне."
"Второй день работаем в крае с помощником президента Максимом Орешкиным. Приехали на стратегически значимые для нашей страны предприятия.

Красмаш делает ракетно-космическую технику, НПП Радиосвязь – навигационную аппаратуру и оборудование связи для нашей армии, КЦЗМ - изделия из драгоценных металлов.

Затем познакомил Максима Станиславовича с ключевыми проектами Сибирского Федерального Университета. Особое внимание уделили разработкам инженерно-строительного института, института нефти и газа, а также лаборатории технологий информационного моделирования.

У нас есть возможность развивать высокотехнологичные производства, готовить специалистов, двигать вперёд науку и промышленность. Федеральная поддержка ускорит это развитие и сделает его непрерывным."
"Сегодня наша страна отмечает День Воздушно-десантных войск. Поздравляю всех, кто связал свою жизнь с крылатой пехотой!

Для каждого из вас тельняшка и голубой берет имеют особый смысл. В боевом братстве ВДВ – люди крепкие телом и сильные духом, настоящие патриоты. Вас отличает высокая профессиональная выучка, готовность выполнить любую задачу.

В ходе специальной военной операции на Украине российский десант показал, что является одним из самых боеспособных родов войск. В его рядах и наши земляки Сергей Михайлов, Алексей Федоренко, Сергей Глазер и многие другие, которые проявили отвагу и отмечены государственными наградами.

Дорогие друзья! Желаю вам доброго здоровья и успехов на службе. Счастья и благополучия родным и близким!"
"Сегодня Президент страны Владимир Владимирович Путин вручил звезду Героя России нашему земляку Олегу Ликонцеву из Канска.

Олег – командир батальона Сибирь, который успешно выполняет боевые задачи в ходе специальной военной операции. Высшую государственную награду получил за подвиги в тяжелых боях под Артемовском. Впервые звание Героя России присвоено казаку-добровольцу.
Олег, мы гордимся тобой! Так держать!"
